{
  "$schema": "http://json-schema.org/draft-07/schema#",
  "title": "CPCBuild project",
  "description": "cpcbuild.json: marks a CPC Game Studio project and lists its build targets.",
  "type": "object",
  "required": ["version", "name", "targets"],
  "additionalProperties": true,
  "properties": {
    "version": { "const": 1, "description": "Project file version." },
    "name": { "type": "string", "minLength": 1, "description": "Project name." },
    "library": { "type": ["string", "null"], "description": "Path to the cpcbuild checkout (folder with lib/ and tools/), relative to this file. null = use the cpcbuild.library.path setting or search upwards." },
    "targets": {
      "type": "array",
      "minItems": 1,
      "items": { "$ref": "#/definitions/target" }
    },
    "assets": { "type": "array", "items": { "type": "string" }, "description": "Glob patterns of Studio asset documents." }
  },
  "definitions": {
    "target": {
      "type": "object",
      "required": ["id", "main"],
      "properties": {
        "id": { "type": "string", "pattern": "^[A-Za-z0-9][A-Za-z0-9_-]*$", "description": "Unique target id; also the output file name in build/." },
        "arch": { "enum": ["cpc", "zx48k"], "default": "cpc" },
        "main": { "type": "string", "description": "The .bas file to compile, relative to this file." },
        "model": { "enum": ["464", "664", "6128", "plus"], "default": "6128", "description": "Emulated model for Run." },
        "defines": { "type": "array", "items": { "type": "string", "pattern": "^\\S+$" }, "description": "-D NAME or NAME=VALUE. The arch macro __CPC__ is automatic." },
        "bare": { "type": "boolean", "description": "Bare metal: adds -D CPC_BAREMETAL." },
        "ownFont": { "type": "boolean", "description": "Adds -D CPC_OWNFONT (a cartridge has no firmware font)." },
        "org": { "type": ["string", "integer", "null"], "description": "Origin (--org): 0x8000, &8000 or decimal. On the CPC at least &0040." },
        "heap": { "type": ["integer", "null"], "minimum": 0, "description": "Heap size in bytes (zxbc -H); used by the Spectrum targets." },
        "package": { "enum": ["dsk", "cpr", "bin", "tap"], "description": "dsk: AMSDOS disc (mkdsk.py). cpr: Plus cartridge (needs bare and ownFont). bin: raw output. tap: Spectrum tape (arch zx48k)." },
        "disc": { "type": "string", "pattern": "^[A-Z0-9]{1,8}$", "description": "AMSDOS name of the program on the disc: 1-8 characters A-Z 0-9 (run\"NAME). Derived from the target id when absent." }
      },
      "allOf": [
        {
          "if": { "properties": { "package": { "const": "cpr" } }, "required": ["package"] },
          "then": { "required": ["bare", "ownFont"], "properties": { "bare": { "const": true }, "ownFont": { "const": true } } }
        }
      ]
    }
  }
}
